{
  "$schema": "../../../profile-schema.json",
  "profile_name": "gitlab-developer",
  "description": "Developer-focused tools for common GitLab workflows",
  
  "parameter_aliases": {
    "id": ["project_id", "group_id", "resource_id"],
    "badge_id": ["badge_id"],
    "branch": ["branch"],
    "user_id": ["user_id"],
    "job_id": ["job_id"],
    "merge_request_iid": ["iid", "mr_iid"],
    "issue_iid": ["iid"]
  },
  
  "tools": [
    {
      "name": "manage_groups",
      "description": "Work with GitLab groups. Actions: 'list' (all groups), 'get' (group details), 'list_projects' (projects in group), 'list_subgroups' (subgroups of group). Use 'list' to discover groups, 'list_projects' to see projects in a specific group.",
      "metadata_params": ["action", "group_id"],
      "operations": {
        "list": "getApiV4Groups",
        "get": "getApiV4GroupsId",
        "list_projects": "getApiV4GroupsIdProjects",
        "list_subgroups": "getApiV4GroupsIdSubgroups"
      },
      "response_fields": {
        "list": ["id", "name", "path", "full_path", "description", "visibility", "web_url"],
        "list_projects": ["id", "name", "path", "path_with_namespace", "description", "visibility", "web_url", "last_activity_at", "star_count", "forks_count", "avatar_url"],
        "list_subgroups": ["id", "name", "path", "full_path", "description", "visibility", "web_url"]
      },
      "parameters": {
        "action": {
          "type": "string",
          "enum": ["list", "get", "list_projects", "list_subgroups"],
          "description": "Action to perform",
          "required": true
        },
        "group_id": {
          "type": "string",
          "description": "Group ID (numeric like '36173' or short name like 'ai-adoption')",
          "required_for": ["get", "list_projects", "list_subgroups"],
          "example": "ai-adoption"
        },
        "page": {
          "type": "integer",
          "description": "Page number for pagination",
          "default": 1
        },
        "per_page": {
          "type": "integer",
          "description": "Items per page (recommended max 100)",
          "default": 20
        },
        "search": {
          "type": "string",
          "description": "Search for groups/projects by name"
        },
        "owned": {
          "type": "boolean",
          "description": "Limit to groups owned by current user (for list action)"
        },
        "archived": {
          "type": "boolean",
          "description": "Limit by archived status (for list_projects action)"
        }
      }
    },

    {
      "name": "manage_projects",
      "description": "Work with GitLab projects. Actions: 'list' (all projects), 'get' (project details), 'search' (search projects). Use 'list' to discover projects, 'search' to find specific ones.",
      "metadata_params": ["action", "project_id"],
      "operations": {
        "list": "getApiV4Projects",
        "get": "getApiV4ProjectsId"
      },
      "response_fields": {
        "list": ["id", "name", "path", "path_with_namespace", "description", "visibility", "web_url", "last_activity_at", "star_count", "forks_count", "avatar_url", "namespace"]
      },
      "parameters": {
        "action": {
          "type": "string",
          "enum": ["list", "get"],
          "description": "Action to perform",
          "required": true
        },
        "project_id": {
          "type": "string",
          "description": "Project ID (numeric like '123' or URL-encoded path like 'group%2Fproject')",
          "required_for": ["get"],
          "example": "123"
        },
        "page": {
          "type": "integer",
          "description": "Page number for pagination",
          "default": 1
        },
        "per_page": {
          "type": "integer",
          "description": "Items per page (recommended max 100)",
          "default": 20
        },
        "search": {
          "type": "string",
          "description": "Search for projects by name or description"
        },
        "owned": {
          "type": "boolean",
          "description": "Limit to projects owned by current user"
        },
        "membership": {
          "type": "boolean",
          "description": "Limit to projects current user is a member of"
        }
      }
    },

    {
      "name": "manage_merge_requests",
      "description": "Work with merge requests. Actions: 'list' (all MRs in project), 'get' (single MR details), 'create' (create new MR), 'delete' (delete MR - admins only). Use 'list' to see all merge requests, filter by state (opened, closed, merged, all).",
      "metadata_params": ["action", "project_id", "merge_request_iid"],
      "operations": {
        "list": "getApiV4ProjectsIdMergeRequests",
        "get": "getApiV4ProjectsIdMergeRequestsMergeRequestIid",
        "create": "postApiV4ProjectsIdMergeRequests",
        "delete": "deleteApiV4ProjectsIdMergeRequestsMergeRequestIid"
      },
      "response_fields": {
        "list": ["id", "iid", "title", "description", "state", "web_url", "author", "created_at", "updated_at"],
        "create": ["id", "iid", "title", "description", "state", "web_url", "author", "created_at"]
      },
      "parameters": {
        "action": {
          "type": "string",
          "enum": ["list", "get", "create", "delete"],
          "description": "Action to perform",
          "required": true
        },
        "project_id": {
          "type": "string",
          "description": "Project ID (numeric like '123' or URL-encoded path like 'group%2Fproject')",
          "required": true,
          "example": "123"
        },
        "merge_request_iid": {
          "type": "integer",
          "description": "The internal ID of the merge request",
          "required_for": ["get"]
        },
        "source_branch": {
          "type": "string",
          "description": "The source branch name (required for create)",
          "required_for": ["create"],
          "example": "feature/new-feature"
        },
        "target_branch": {
          "type": "string",
          "description": "The target branch name (required for create)",
          "required_for": ["create"],
          "example": "main"
        },
        "title": {
          "type": "string",
          "description": "The title of the merge request (required for create)",
          "required_for": ["create"],
          "example": "Implement new feature"
        },
        "description": {
          "type": "string",
          "description": "The description of the merge request (optional for create)",
          "example": "This implements the new feature requested by the team."
        },
        "assignee_id": {
          "type": "integer",
          "description": "The ID of the user to assign the merge request to (optional for create)",
          "example": 123
        },
        "assignee_ids": {
          "type": "array",
          "items": {
            "type": "integer"
          },
          "description": "The IDs of the users to assign the merge request to (optional for create)",
          "example": [123, 456]
        },
        "reviewer_ids": {
          "type": "array",
          "items": {
            "type": "integer"
          },
          "description": "The IDs of the users to review the merge request (optional for create)",
          "example": [789, 101]
        },
        "labels": {
          "type": "string",
          "description": "Labels to be added to the merge request (comma-separated, optional for create)",
          "example": "bug,feature,frontend"
        },
        "milestone_id": {
          "type": "integer",
          "description": "The ID of the milestone to assign the merge request to (optional for create)",
          "example": 42
        },
        "allow_collaboration": {
          "type": "boolean",
          "description": "Allow commits from the target branch to be pushed to the source branch (optional for create)",
          "default": false,
          "example": true
        },
        "allow_maintainer_to_push": {
          "type": "boolean",
          "description": "Allow maintainers to push to the source branch (optional for create)",
          "default": false,
          "example": true
        },
        "squash": {
          "type": "boolean",
          "description": "Squash commits when merge request is accepted (optional for create)",
          "default": false,
          "example": true
        },
        "target_project_id": {
          "type": "integer",
          "description": "The target project ID (when creating merge request across projects, optional for create)",
          "example": 789
        },
        "remove_source_branch": {
          "type": "boolean",
          "description": "Remove the source branch when the merge request is accepted (optional for create)",
          "default": false,
          "example": true
        },
        "draft": {
          "type": "boolean",
          "description": "Mark the merge request as a draft (optional for create)",
          "default": false,
          "example": false
        },
        "state": {
          "type": "string",
          "enum": ["opened", "closed", "merged", "all"],
          "description": "Filter by merge request state",
          "default": "opened"
        },
        "page": {
          "type": "integer",
          "description": "Page number for pagination",
          "default": 1
        },
        "per_page": {
          "type": "integer",
          "description": "Items per page (recommended max 100)",
          "default": 20
        }
      }
    },

    {
      "name": "manage_issues",
      "description": "Work with issues. Actions: 'list' (all issues in project), 'get' (single issue details), 'create' (create new issue), 'delete' (delete issue - admins only). Use 'list' to see all issues, filter by state (opened, closed, all).",
      "metadata_params": ["action", "project_id", "issue_iid"],